timestamp,packetLength,info,networkInterface.sourceMAC, networkInterface.destinationMAC,internet.sourceIP,internet.destinationIP,internet.protocol,TCP.sourcePort,TCP.destinationPort,TCP.flags,TCP.calculatedWindowSize,UDP.sourcePort,UDP.destinationPort,MQTT.flags,MQTT.message,MQTT.topic,MQTT.messageLength,MQTT.frameCounter
1517688352799319,100,Publish Message,08:00:27:71:f1:05,08:00:27:53:41:85,192.168.1.7,192.168.1.5,MQTT,52588,1883,0x018,229,-1,-1,0x30,62.7216410003,fakeSensor2/sound,32,1
1517688352837583,66,1883  >  52588 [ACK] Seq=1 Ack=35 Win=227 Len=0 TSval=917745 TSecr=1131028,08:00:27:53:41:85,08:00:27:71:f1:05,192.168.1.5,192.168.1.7,TCP,1883,52588,0x010,227,-1,-1,-1,-1,-1,-1,1
1517688352965108,100,Publish Message,08:00:27:0e:06:81,08:00:27:53:41:85,192.168.1.4,192.168.1.5,MQTT,59662,1883,0x018,229,-1,-1,0x30,46.1680763098,fakeSensor3/sound,32,1
1517688352965147,66,1883  >  59662 [ACK] Seq=1 Ack=35 Win=227 Len=0 TSval=917776 TSecr=800538,08:00:27:53:41:85,08:00:27:0e:06:81,192.168.1.5,192.168.1.4,TCP,1883,59662,0x010,227,-1,-1,-1,-1,-1,-1,1
1517688354027486,100,Publish Message,08:00:27:0e:06:81,08:00:27:53:41:85,192.168.1.4,192.168.1.5,MQTT,59662,1883,0x018,229,-1,-1,0x30,31.8849343769,fakeSensor3/sound,32,1
1517688354027533,66,1883  >  59662 [ACK] Seq=1 Ack=69 Win=227 Len=0 TSval=918042 TSecr=800804,08:00:27:53:41:85,08:00:27:0e:06:81,192.168.1.5,192.168.1.4,TCP,1883,59662,0x010,227,-1,-1,-1,-1,-1,-1,1
1517688354060207,100,Publish Message,08:00:27:71:f1:05,08:00:27:53:41:85,192.168.1.7,192.168.1.5,MQTT,52588,1883,0x018,229,-1,-1,0x30,88.6894244115,fakeSensor2/sound,32,1
1517688354060223,66,1883  >  52588 [ACK] Seq=1 Ack=69 Win=227 Len=0 TSval=918050 TSecr=1131343,08:00:27:53:41:85,08:00:27:71:f1:05,192.168.1.5,192.168.1.7,TCP,1883,52588,0x010,227,-1,-1,-1,-1,-1,-1,1
1517688355275614,100,Publish Message,08:00:27:0e:06:81,08:00:27:53:41:85,192.168.1.4,192.168.1.5,MQTT,59662,1883,0x018,229,-1,-1,0x30,53.8000585052,fakeSensor3/sound,32,1
1517688355275646,66,1883  >  59662 [ACK] Seq=1 Ack=103 Win=227 Len=0 TSval=918354 TSecr=801116,08:00:27:53:41:85,08:00:27:0e:06:81,192.168.1.5,192.168.1.4,TCP,1883,59662,0x010,227,-1,-1,-1,-1,-1,-1,1
1517688356033918,100,Publish Message,08:00:27:71:f1:05,08:00:27:53:41:85,192.168.1.7,192.168.1.5,MQTT,52588,1883,0x018,229,-1,-1,0x30,27.5352359332,fakeSensor2/sound,32,1
1517688356033956,66,1883  >  52588 [ACK] Seq=1 Ack=103 Win=227 Len=0 TSval=918544 TSecr=1131836,08:00:27:53:41:85,08:00:27:71:f1:05,192.168.1.5,192.168.1.7,TCP,1883,52588,0x010,227,-1,-1,-1,-1,-1,-1,1
1517688356085826,99,Publish Message,08:00:27:0e:06:81,08:00:27:53:41:85,192.168.1.4,192.168.1.5,MQTT,59662,1883,0x018,229,-1,-1,0x30,78.064482416,fakeSensor3/sound,31,1
1517688356085852,66,1883  >  59662 [ACK] Seq=1 Ack=136 Win=227 Len=0 TSval=918557 TSecr=801319,08:00:27:53:41:85,08:00:27:0e:06:81,192.168.1.5,192.168.1.4,TCP,1883,59662,0x010,227,-1,-1,-1,-1,-1,-1,1
1517688356950746,99,Publish Message,08:00:27:0e:06:81,08:00:27:53:41:85,192.168.1.4,192.168.1.5,MQTT,59662,1883,0x018,229,-1,-1,0x30,80.117284545,fakeSensor3/sound,31,1
1517688356950775,66,1883  >  59662 [ACK] Seq=1 Ack=169 Win=227 Len=0 TSval=918773 TSecr=801535,08:00:27:53:41:85,08:00:27:0e:06:81,192.168.1.5,192.168.1.4,TCP,1883,59662,0x010,227,-1,-1,-1,-1,-1,-1,1
1517688357809751,100,Publish Message,08:00:27:0e:06:81,08:00:27:53:41:85,192.168.1.4,192.168.1.5,MQTT,59662,1883,0x018,229,-1,-1,0x30,110.554690513,fakeSensor3/sound,32,1
1517688357809786,66,1883  >  59662 [ACK] Seq=1 Ack=203 Win=227 Len=0 TSval=918988 TSecr=801750,08:00:27:53:41:85,08:00:27:0e:06:81,192.168.1.5,192.168.1.4,TCP,1883,59662,0x010,227,-1,-1,-1,-1,-1,-1,1
1517688357869360,100,Publish Message,08:00:27:71:f1:05,08:00:27:53:41:85,192.168.1.7,192.168.1.5,MQTT,52588,1883,0x018,229,-1,-1,0x30,96.7230731537,fakeSensor2/sound,32,1
1517688357869391,66,1883  >  52588 [ACK] Seq=1 Ack=137 Win=227 Len=0 TSval=919003 TSecr=1132295,08:00:27:53:41:85,08:00:27:71:f1:05,192.168.1.5,192.168.1.7,TCP,1883,52588,0x010,227,-1,-1,-1,-1,-1,-1,1
1517688358351702,100,Publish Message,08:00:27:0e:06:81,08:00:27:53:41:85,192.168.1.4,192.168.1.5,MQTT,59662,1883,0x018,229,-1,-1,0x30,74.2198396608,fakeSensor3/sound,32,1
1517688358351719,66,1883  >  59662 [ACK] Seq=1 Ack=237 Win=227 Len=0 TSval=919123 TSecr=801885,08:00:27:53:41:85,08:00:27:0e:06:81,192.168.1.5,192.168.1.4,TCP,1883,59662,0x010,227,-1,-1,-1,-1,-1,-1,1
1517688358859624,100,Publish Message,08:00:27:71:f1:05,08:00:27:53:41:85,192.168.1.7,192.168.1.5,MQTT,52588,1883,0x018,229,-1,-1,0x30,64.3488586357,fakeSensor2/sound,32,1
1517688358859641,66,1883  >  52588 [ACK] Seq=1 Ack=171 Win=227 Len=0 TSval=919250 TSecr=1132543,08:00:27:53:41:85,08:00:27:71:f1:05,192.168.1.5,192.168.1.7,TCP,1883,52588,0x010,227,-1,-1,-1,-1,-1,-1,1
1517688358960387,99,Publish Message,08:00:27:0e:06:81,08:00:27:53:41:85,192.168.1.4,192.168.1.5,MQTT,59662,1883,0x018,229,-1,-1,0x30,39.030647831,fakeSensor3/sound,31,1
1517688358960404,66,1883  >  59662 [ACK] Seq=1 Ack=270 Win=227 Len=0 TSval=919275 TSecr=802037,08:00:27:53:41:85,08:00:27:0e:06:81,192.168.1.5,192.168.1.4,TCP,1883,59662,0x010,227,-1,-1,-1,-1,-1,-1,1
1517688359611595,100,Publish Message,08:00:27:0e:06:81,08:00:27:53:41:85,192.168.1.4,192.168.1.5,MQTT,59662,1883,0x018,229,-1,-1,0x30,93.7240499517,fakeSensor3/sound,32,1
1517688359611613,66,1883  >  59662 [ACK] Seq=1 Ack=304 Win=227 Len=0 TSval=919438 TSecr=802200,08:00:27:53:41:85,08:00:27:0e:06:81,192.168.1.5,192.168.1.4,TCP,1883,59662,0x010,227,-1,-1,-1,-1,-1,-1,1
1517688360271121,100,Publish Message,08:00:27:71:f1:05,08:00:27:53:41:85,192.168.1.7,192.168.1.5,MQTT,52588,1883,0x018,229,-1,-1,0x30,41.3567499747,fakeSensor2/sound,32,1
1517688360271175,66,1883  >  52588 [ACK] Seq=1 Ack=205 Win=227 Len=0 TSval=919603 TSecr=1132895,08:00:27:53:41:85,08:00:27:71:f1:05,192.168.1.5,192.168.1.7,TCP,1883,52588,0x010,227,-1,-1,-1,-1,-1,-1,1
1517688360892916,100,Publish Message,08:00:27:71:f1:05,08:00:27:53:41:85,192.168.1.7,192.168.1.5,MQTT,52588,1883,0x018,229,-1,-1,0x30,43.4742013453,fakeSensor2/sound,32,1
1517688360892943,66,1883  >  52588 [ACK] Seq=1 Ack=239 Win=227 Len=0 TSval=919758 TSecr=1133051,08:00:27:53:41:85,08:00:27:71:f1:05,192.168.1.5,192.168.1.7,TCP,1883,52588,0x010,227,-1,-1,-1,-1,-1,-1,1
1517688361533421,100,Publish Message,08:00:27:0e:06:81,08:00:27:53:41:85,192.168.1.4,192.168.1.5,MQTT,59662,1883,0x018,229,-1,-1,0x30,112.994067613,fakeSensor3/sound,32,1
1517688361533439,66,1883  >  59662 [ACK] Seq=1 Ack=338 Win=227 Len=0 TSval=919919 TSecr=802680,08:00:27:53:41:85,08:00:27:0e:06:81,192.168.1.5,192.168.1.4,TCP,1883,59662,0x010,227,-1,-1,-1,-1,-1,-1,1
1517688362055623,100,Publish Message,08:00:27:0e:06:81,08:00:27:53:41:85,192.168.1.4,192.168.1.5,MQTT,59662,1883,0x018,229,-1,-1,0x30,117.839381872,fakeSensor3/sound,32,1
1517688362055642,66,1883  >  59662 [ACK] Seq=1 Ack=372 Win=227 Len=0 TSval=920049 TSecr=802811,08:00:27:53:41:85,08:00:27:0e:06:81,192.168.1.5,192.168.1.4,TCP,1883,59662,0x010,227,-1,-1,-1,-1,-1,-1,1
1517688362707973,99,Publish Message,08:00:27:71:f1:05,08:00:27:53:41:85,192.168.1.7,192.168.1.5,MQTT,52588,1883,0x018,229,-1,-1,0x30,100.80911079,fakeSensor2/sound,31,1
1517688362708003,66,1883  >  52588 [ACK] Seq=1 Ack=272 Win=227 Len=0 TSval=920212 TSecr=1133505,08:00:27:53:41:85,08:00:27:71:f1:05,192.168.1.5,192.168.1.7,TCP,1883,52588,0x010,227,-1,-1,-1,-1,-1,-1,1
1517688362987724,100,Publish Message,08:00:27:0e:06:81,08:00:27:53:41:85,192.168.1.4,192.168.1.5,MQTT,59662,1883,0x018,229,-1,-1,0x30,66.9931537893,fakeSensor3/sound,32,1
1517688362987751,66,1883  >  59662 [ACK] Seq=1 Ack=406 Win=227 Len=0 TSval=920282 TSecr=803044,08:00:27:53:41:85,08:00:27:0e:06:81,192.168.1.5,192.168.1.4,TCP,1883,59662,0x010,227,-1,-1,-1,-1,-1,-1,1
1517688363274631,100,Publish Message,08:00:27:71:f1:05,08:00:27:53:41:85,192.168.1.7,192.168.1.5,MQTT,52588,1883,0x018,229,-1,-1,0x30,42.7960219381,fakeSensor2/sound,32,1
1517688363274652,66,1883  >  52588 [ACK] Seq=1 Ack=306 Win=227 Len=0 TSval=920354 TSecr=1133646,08:00:27:53:41:85,08:00:27:71:f1:05,192.168.1.5,192.168.1.7,TCP,1883,52588,0x010,227,-1,-1,-1,-1,-1,-1,1
1517688363969530,42,Who has 192.168.1.4? Tell 192.168.1.5,08:00:27:53:41:85,08:00:27:0e:06:81,PcsCompu_53:41:85,PcsCompu_0e:06:81,ARP,-1,-1,-1,-1,-1,-1,-1,-1,-1,-1,1
1517688363969801,60,192.168.1.4 is at 08:00:27:0e:06:81,08:00:27:0e:06:81,08:00:27:53:41:85,PcsCompu_0e:06:81,PcsCompu_53:41:85,ARP,-1,-1,-1,-1,-1,-1,-1,-1,-1,-1,1
1517688364582000,99,Publish Message,08:00:27:0e:06:81,08:00:27:53:41:85,192.168.1.4,192.168.1.5,MQTT,59662,1883,0x018,229,-1,-1,0x30,20.912529858,fakeSensor3/sound,31,1
1517688364582036,66,1883  >  59662 [ACK] Seq=1 Ack=439 Win=227 Len=0 TSval=920681 TSecr=803443,08:00:27:53:41:85,08:00:27:0e:06:81,192.168.1.5,192.168.1.4,TCP,1883,59662,0x010,227,-1,-1,-1,-1,-1,-1,1
1517688364599836,100,Publish Message,08:00:27:71:f1:05,08:00:27:53:41:85,192.168.1.7,192.168.1.5,MQTT,52588,1883,0x018,229,-1,-1,0x30,100.520869675,fakeSensor2/sound,32,1
1517688364599858,66,1883  >  52588 [ACK] Seq=1 Ack=340 Win=227 Len=0 TSval=920685 TSecr=1133977,08:00:27:53:41:85,08:00:27:71:f1:05,192.168.1.5,192.168.1.7,TCP,1883,52588,0x010,227,-1,-1,-1,-1,-1,-1,1
1517688365625883,100,Publish Message,08:00:27:0e:06:81,08:00:27:53:41:85,192.168.1.4,192.168.1.5,MQTT,59662,1883,0x018,229,-1,-1,0x30,118.047212138,fakeSensor3/sound,32,1
1517688365625903,66,1883  >  59662 [ACK] Seq=1 Ack=473 Win=227 Len=0 TSval=920942 TSecr=803704,08:00:27:53:41:85,08:00:27:0e:06:81,192.168.1.5,192.168.1.4,TCP,1883,59662,0x010,227,-1,-1,-1,-1,-1,-1,1
1517688366111181,100,Publish Message,08:00:27:71:f1:05,08:00:27:53:41:85,192.168.1.7,192.168.1.5,MQTT,52588,1883,0x018,229,-1,-1,0x30,83.0237190395,fakeSensor2/sound,32,1
1517688366111199,66,1883  >  52588 [ACK] Seq=1 Ack=374 Win=227 Len=0 TSval=921063 TSecr=1134355,08:00:27:53:41:85,08:00:27:71:f1:05,192.168.1.5,192.168.1.7,TCP,1883,52588,0x010,227,-1,-1,-1,-1,-1,-1,1
1517688366610445,99,Publish Message,08:00:27:0e:06:81,08:00:27:53:41:85,192.168.1.4,192.168.1.5,MQTT,59662,1883,0x018,229,-1,-1,0x30,108.06029309,fakeSensor3/sound,31,1
1517688366610472,66,1883  >  59662 [ACK] Seq=1 Ack=506 Win=227 Len=0 TSval=921188 TSecr=803950,08:00:27:53:41:85,08:00:27:0e:06:81,192.168.1.5,192.168.1.4,TCP,1883,59662,0x010,227,-1,-1,-1,-1,-1,-1,1
1517688367181241,100,Publish Message,08:00:27:0e:06:81,08:00:27:53:41:85,192.168.1.4,192.168.1.5,MQTT,59662,1883,0x018,229,-1,-1,0x30,56.1053372213,fakeSensor3/sound,32,1
1517688367181265,66,1883  >  59662 [ACK] Seq=1 Ack=540 Win=227 Len=0 TSval=921331 TSecr=804092,08:00:27:53:41:85,08:00:27:0e:06:81,192.168.1.5,192.168.1.4,TCP,1883,59662,0x010,227,-1,-1,-1,-1,-1,-1,1
1517688367442300,100,Publish Message,08:00:27:71:f1:05,08:00:27:53:41:85,192.168.1.7,192.168.1.5,MQTT,52588,1883,0x018,229,-1,-1,0x30,84.9626174917,fakeSensor2/sound,32,1
1517688367442335,66,1883  >  52588 [ACK] Seq=1 Ack=408 Win=227 Len=0 TSval=921396 TSecr=1134688,08:00:27:53:41:85,08:00:27:71:f1:05,192.168.1.5,192.168.1.7,TCP,1883,52588,0x010,227,-1,-1,-1,-1,-1,-1,1
1517688368603168,100,Publish Message,08:00:27:0e:06:81,08:00:27:53:41:85,192.168.1.4,192.168.1.5,MQTT,59662,1883,0x018,229,-1,-1,0x30,62.7534895691,fakeSensor3/sound,32,1
1517688368603202,66,1883  >  59662 [ACK] Seq=1 Ack=574 Win=227 Len=0 TSval=921686 TSecr=804448,08:00:27:53:41:85,08:00:27:0e:06:81,192.168.1.5,192.168.1.4,TCP,1883,59662,0x010,227,-1,-1,-1,-1,-1,-1,1
1517688369289427,100,Publish Message,08:00:27:71:f1:05,08:00:27:53:41:85,192.168.1.7,192.168.1.5,MQTT,52588,1883,0x018,229,-1,-1,0x30,95.1850275629,fakeSensor2/sound,32,1
1517688369289467,66,1883  >  52588 [ACK] Seq=1 Ack=442 Win=227 Len=0 TSval=921858 TSecr=1135150,08:00:27:53:41:85,08:00:27:71:f1:05,192.168.1.5,192.168.1.7,TCP,1883,52588,0x010,227,-1,-1,-1,-1,-1,-1,1
1517688369569046,100,Publish Message,08:00:27:0e:06:81,08:00:27:53:41:85,192.168.1.4,192.168.1.5,MQTT,59662,1883,0x018,229,-1,-1,0x30,65.1850702719,fakeSensor3/sound,32,1
1517688369569066,66,1883  >  59662 [ACK] Seq=1 Ack=608 Win=227 Len=0 TSval=921927 TSecr=804689,08:00:27:53:41:85,08:00:27:0e:06:81,192.168.1.5,192.168.1.4,TCP,1883,59662,0x010,227,-1,-1,-1,-1,-1,-1,1
1517688370894791,100,Publish Message,08:00:27:71:f1:05,08:00:27:53:41:85,192.168.1.7,192.168.1.5,MQTT,52588,1883,0x018,229,-1,-1,0x30,55.9050895664,fakeSensor2/sound,32,1
1517688370894820,66,1883  >  52588 [ACK] Seq=1 Ack=476 Win=227 Len=0 TSval=922259 TSecr=1135551,08:00:27:53:41:85,08:00:27:71:f1:05,192.168.1.5,192.168.1.7,TCP,1883,52588,0x010,227,-1,-1,-1,-1,-1,-1,1
1517688371287833,100,Publish Message,08:00:27:0e:06:81,08:00:27:53:41:85,192.168.1.4,192.168.1.5,MQTT,59662,1883,0x018,229,-1,-1,0x30,87.6459533508,fakeSensor3/sound,32,1
1517688371287863,66,1883  >  59662 [ACK] Seq=1 Ack=642 Win=227 Len=0 TSval=922357 TSecr=805119,08:00:27:53:41:85,08:00:27:0e:06:81,192.168.1.5,192.168.1.4,TCP,1883,59662,0x010,227,-1,-1,-1,-1,-1,-1,1
1517688371526041,100,Publish Message,08:00:27:71:f1:05,08:00:27:53:41:85,192.168.1.7,192.168.1.5,MQTT,52588,1883,0x018,229,-1,-1,0x30,65.9788935131,fakeSensor2/sound,32,1
1517688371526073,66,1883  >  52588 [ACK] Seq=1 Ack=510 Win=227 Len=0 TSval=922417 TSecr=1135709,08:00:27:53:41:85,08:00:27:71:f1:05,192.168.1.5,192.168.1.7,TCP,1883,52588,0x010,227,-1,-1,-1,-1,-1,-1,1
1517688372839163,100,Publish Message,08:00:27:71:f1:05,08:00:27:53:41:85,192.168.1.7,192.168.1.5,MQTT,52588,1883,0x018,229,-1,-1,0x30,31.5854177292,fakeSensor2/sound,32,1
1517688372839198,66,1883  >  52588 [ACK] Seq=1 Ack=544 Win=227 Len=0 TSval=922745 TSecr=1136037,08:00:27:53:41:85,08:00:27:71:f1:05,192.168.1.5,192.168.1.7,TCP,1883,52588,0x010,227,-1,-1,-1,-1,-1,-1,1
1517688372965729,99,Publish Message,08:00:27:0e:06:81,08:00:27:53:41:85,192.168.1.4,192.168.1.5,MQTT,59662,1883,0x018,229,-1,-1,0x30,72.564182268,fakeSensor3/sound,31,1
1517688372965749,66,1883  >  59662 [ACK] Seq=1 Ack=675 Win=227 Len=0 TSval=922777 TSecr=805539,08:00:27:53:41:85,08:00:27:0e:06:81,192.168.1.5,192.168.1.4,TCP,1883,59662,0x010,227,-1,-1,-1,-1,-1,-1,1
1517688373822122,100,Publish Message,08:00:27:0e:06:81,08:00:27:53:41:85,192.168.1.4,192.168.1.5,MQTT,59662,1883,0x018,229,-1,-1,0x30,31.8458845077,fakeSensor3/sound,32,1
1517688373822161,66,1883  >  59662 [ACK] Seq=1 Ack=709 Win=227 Len=0 TSval=922991 TSecr=805753,08:00:27:53:41:85,08:00:27:0e:06:81,192.168.1.5,192.168.1.4,TCP,1883,59662,0x010,227,-1,-1,-1,-1,-1,-1,1
1517688374544734,100,Publish Message,08:00:27:71:f1:05,08:00:27:53:41:85,192.168.1.7,192.168.1.5,MQTT,52588,1883,0x018,229,-1,-1,0x30,32.6711098178,fakeSensor2/sound,32,1
1517688374544765,66,1883  >  52588 [ACK] Seq=1 Ack=578 Win=227 Len=0 TSval=923171 TSecr=1136464,08:00:27:53:41:85,08:00:27:71:f1:05,192.168.1.5,192.168.1.7,TCP,1883,52588,0x010,227,-1,-1,-1,-1,-1,-1,1
1517688374817834,100,Publish Message,08:00:27:0e:06:81,08:00:27:53:41:85,192.168.1.4,192.168.1.5,MQTT,59662,1883,0x018,229,-1,-1,0x30,78.3927409159,fakeSensor3/sound,32,1
1517688374817864,66,1883  >  59662 [ACK] Seq=1 Ack=743 Win=227 Len=0 TSval=923240 TSecr=806002,08:00:27:53:41:85,08:00:27:0e:06:81,192.168.1.5,192.168.1.4,TCP,1883,59662,0x010,227,-1,-1,-1,-1,-1,-1,1
1517688375402590,100,Publish Message,08:00:27:71:f1:05,08:00:27:53:41:85,192.168.1.7,192.168.1.5,MQTT,52588,1883,0x018,229,-1,-1,0x30,22.5365527534,fakeSensor2/sound,32,1
1517688375402634,66,1883  >  52588 [ACK] Seq=1 Ack=612 Win=227 Len=0 TSval=923386 TSecr=1136678,08:00:27:53:41:85,08:00:27:71:f1:05,192.168.1.5,192.168.1.7,TCP,1883,52588,0x010,227,-1,-1,-1,-1,-1,-1,1
1517688376106271,100,Publish Message,08:00:27:0e:06:81,08:00:27:53:41:85,192.168.1.4,192.168.1.5,MQTT,59662,1883,0x018,229,-1,-1,0x30,62.4923094316,fakeSensor3/sound,32,1
1517688376106299,66,1883  >  59662 [ACK] Seq=1 Ack=777 Win=227 Len=0 TSval=923562 TSecr=806324,08:00:27:53:41:85,08:00:27:0e:06:81,192.168.1.5,192.168.1.4,TCP,1883,59662,0x010,227,-1,-1,-1,-1,-1,-1,1
1517688376875749,100,Publish Message,08:00:27:71:f1:05,08:00:27:53:41:85,192.168.1.7,192.168.1.5,MQTT,52588,1883,0x018,229,-1,-1,0x30,82.3803347484,fakeSensor2/sound,32,1
1517688376875772,66,1883  >  52588 [ACK] Seq=1 Ack=646 Win=227 Len=0 TSval=923754 TSecr=1137046,08:00:27:53:41:85,08:00:27:71:f1:05,192.168.1.5,192.168.1.7,TCP,1883,52588,0x010,227,-1,-1,-1,-1,-1,-1,1
1517688377460663,100,Publish Message,08:00:27:0e:06:81,08:00:27:53:41:85,192.168.1.4,192.168.1.5,MQTT,59662,1883,0x018,229,-1,-1,0x30,87.1138936784,fakeSensor3/sound,32,1
1517688377460693,66,1883  >  59662 [ACK] Seq=1 Ack=811 Win=227 Len=0 TSval=923900 TSecr=806662,08:00:27:53:41:85,08:00:27:0e:06:81,192.168.1.5,192.168.1.4,TCP,1883,59662,0x010,227,-1,-1,-1,-1,-1,-1,1
1517688378250744,100,Publish Message,08:00:27:71:f1:05,08:00:27:53:41:85,192.168.1.7,192.168.1.5,MQTT,52588,1883,0x018,229,-1,-1,0x30,25.8249425163,fakeSensor2/sound,32,1
1517688378250785,66,1883  >  52588 [ACK] Seq=1 Ack=680 Win=227 Len=0 TSval=924098 TSecr=1137390,08:00:27:53:41:85,08:00:27:71:f1:05,192.168.1.5,192.168.1.7,TCP,1883,52588,0x010,227,-1,-1,-1,-1,-1,-1,1
1517688378400050,100,Publish Message,08:00:27:0e:06:81,08:00:27:53:41:85,192.168.1.4,192.168.1.5,MQTT,59662,1883,0x018,229,-1,-1,0x30,56.0818896611,fakeSensor3/sound,32,1
1517688378400083,66,1883  >  59662 [ACK] Seq=1 Ack=845 Win=227 Len=0 TSval=924135 TSecr=806897,08:00:27:53:41:85,08:00:27:0e:06:81,192.168.1.5,192.168.1.4,TCP,1883,59662,0x010,227,-1,-1,-1,-1,-1,-1,1
1517688379568989,100,Publish Message,08:00:27:71:f1:05,08:00:27:53:41:85,192.168.1.7,192.168.1.5,MQTT,52588,1883,0x018,229,-1,-1,0x30,100.854132581,fakeSensor2/sound,32,1
1517688379569026,66,1883  >  52588 [ACK] Seq=1 Ack=714 Win=227 Len=0 TSval=924427 TSecr=1137720,08:00:27:53:41:85,08:00:27:71:f1:05,192.168.1.5,192.168.1.7,TCP,1883,52588,0x010,227,-1,-1,-1,-1,-1,-1,1
1517688380297741,100,Publish Message,08:00:27:0e:06:81,08:00:27:53:41:85,192.168.1.4,192.168.1.5,MQTT,59662,1883,0x018,229,-1,-1,0x30,114.326738442,fakeSensor3/sound,32,1
1517688380297770,66,1883  >  59662 [ACK] Seq=1 Ack=879 Win=227 Len=0 TSval=924610 TSecr=807371,08:00:27:53:41:85,08:00:27:0e:06:81,192.168.1.5,192.168.1.4,TCP,1883,59662,0x010,227,-1,-1,-1,-1,-1,-1,1
1517688381547165,100,Publish Message,08:00:27:71:f1:05,08:00:27:53:41:85,192.168.1.7,192.168.1.5,MQTT,52588,1883,0x018,229,-1,-1,0x30,92.7589029149,fakeSensor2/sound,32,1
1517688381547184,66,1883  >  52588 [ACK] Seq=1 Ack=748 Win=227 Len=0 TSval=924922 TSecr=1138214,08:00:27:53:41:85,08:00:27:71:f1:05,192.168.1.5,192.168.1.7,TCP,1883,52588,0x010,227,-1,-1,-1,-1,-1,-1,1
1517688381994629,100,Publish Message,08:00:27:0e:06:81,08:00:27:53:41:85,192.168.1.4,192.168.1.5,MQTT,59662,1883,0x018,229,-1,-1,0x30,57.9157025729,fakeSensor3/sound,32,1
1517688381994660,66,1883  >  59662 [ACK] Seq=1 Ack=913 Win=227 Len=0 TSval=925034 TSecr=807796,08:00:27:53:41:85,08:00:27:0e:06:81,192.168.1.5,192.168.1.4,TCP,1883,59662,0x010,227,-1,-1,-1,-1,-1,-1,1
1517688382606159,100,Publish Message,08:00:27:0e:06:81,08:00:27:53:41:85,192.168.1.4,192.168.1.5,MQTT,59662,1883,0x018,229,-1,-1,0x30,37.0824847755,fakeSensor3/sound,32,1
1517688382606198,66,1883  >  59662 [ACK] Seq=1 Ack=947 Win=227 Len=0 TSval=925187 TSecr=807949,08:00:27:53:41:85,08:00:27:0e:06:81,192.168.1.5,192.168.1.4,TCP,1883,59662,0x010,227,-1,-1,-1,-1,-1,-1,1
1517688382729795,100,Publish Message,08:00:27:71:f1:05,08:00:27:53:41:85,192.168.1.7,192.168.1.5,MQTT,52588,1883,0x018,229,-1,-1,0x30,35.3475408021,fakeSensor2/sound,32,1
1517688382729814,66,1883  >  52588 [ACK] Seq=1 Ack=782 Win=227 Len=0 TSval=925218 TSecr=1138510,08:00:27:53:41:85,08:00:27:71:f1:05,192.168.1.5,192.168.1.7,TCP,1883,52588,0x010,227,-1,-1,-1,-1,-1,-1,1
1517688383358111,100,Publish Message,08:00:27:71:f1:05,08:00:27:53:41:85,192.168.1.7,192.168.1.5,MQTT,52588,1883,0x018,229,-1,-1,0x30,110.425961954,fakeSensor2/sound,32,1
1517688383358135,66,1883  >  52588 [ACK] Seq=1 Ack=816 Win=227 Len=0 TSval=925375 TSecr=1138667,08:00:27:53:41:85,08:00:27:71:f1:05,192.168.1.5,192.168.1.7,TCP,1883,52588,0x010,227,-1,-1,-1,-1,-1,-1,1
1517688383803984,100,Publish Message,08:00:27:0e:06:81,08:00:27:53:41:85,192.168.1.4,192.168.1.5,MQTT,59662,1883,0x018,229,-1,-1,0x30,54.4429205224,fakeSensor3/sound,32,1
1517688383804015,66,1883  >  59662 [ACK] Seq=1 Ack=981 Win=227 Len=0 TSval=925486 TSecr=808248,08:00:27:53:41:85,08:00:27:0e:06:81,192.168.1.5,192.168.1.4,TCP,1883,59662,0x010,227,-1,-1,-1,-1,-1,-1,1
1517688384653931,100,Publish Message,08:00:27:71:f1:05,08:00:27:53:41:85,192.168.1.7,192.168.1.5,MQTT,52588,1883,0x018,229,-1,-1,0x30,22.6112896005,fakeSensor2/sound,32,1
1517688384653969,66,1883  >  52588 [ACK] Seq=1 Ack=850 Win=227 Len=0 TSval=925699 TSecr=1138991,08:00:27:53:41:85,08:00:27:71:f1:05,192.168.1.5,192.168.1.7,TCP,1883,52588,0x010,227,-1,-1,-1,-1,-1,-1,1
1517688385735485,99,Publish Message,08:00:27:0e:06:81,08:00:27:53:41:85,192.168.1.4,192.168.1.5,MQTT,59662,1883,0x018,229,-1,-1,0x30,112.53684029,fakeSensor3/sound,31,1
1517688385735521,66,1883  >  59662 [ACK] Seq=1 Ack=1014 Win=227 Len=0 TSval=925969 TSecr=808731,08:00:27:53:41:85,08:00:27:0e:06:81,192.168.1.5,192.168.1.4,TCP,1883,59662,0x010,227,-1,-1,-1,-1,-1,-1,1
1517688385785184,100,Publish Message,08:00:27:71:f1:05,08:00:27:53:41:85,192.168.1.7,192.168.1.5,MQTT,52588,1883,0x018,229,-1,-1,0x30,49.1832675322,fakeSensor2/sound,32,1
1517688385785204,66,1883  >  52588 [ACK] Seq=1 Ack=884 Win=227 Len=0 TSval=925982 TSecr=1139274,08:00:27:53:41:85,08:00:27:71:f1:05,192.168.1.5,192.168.1.7,TCP,1883,52588,0x010,227,-1,-1,-1,-1,-1,-1,1
1517688386648438,100,Publish Message,08:00:27:0e:06:81,08:00:27:53:41:85,192.168.1.4,192.168.1.5,MQTT,59662,1883,0x018,229,-1,-1,0x30,41.0661916264,fakeSensor3/sound,32,1
1517688386648455,66,1883  >  59662 [ACK] Seq=1 Ack=1048 Win=227 Len=0 TSval=926197 TSecr=808959,08:00:27:53:41:85,08:00:27:0e:06:81,192.168.1.5,192.168.1.4,TCP,1883,59662,0x010,227,-1,-1,-1,-1,-1,-1,1
1517688387424106,100,Publish Message,08:00:27:71:f1:05,08:00:27:53:41:85,192.168.1.7,192.168.1.5,MQTT,52588,1883,0x018,229,-1,-1,0x30,79.8567478335,fakeSensor2/sound,32,1
1517688387424134,66,1883  >  52588 [ACK] Seq=1 Ack=918 Win=227 Len=0 TSval=926391 TSecr=1139683,08:00:27:53:41:85,08:00:27:71:f1:05,192.168.1.5,192.168.1.7,TCP,1883,52588,0x010,227,-1,-1,-1,-1,-1,-1,1
1517688387650290,68,Ping Request,08:00:27:0e:06:81,08:00:27:53:41:85,192.168.1.4,192.168.1.5,MQTT,59662,1883,0x018,229,-1,-1,0xc0,-1,-1,0,1
1517688387650327,66,1883  >  59662 [ACK] Seq=1 Ack=1050 Win=227 Len=0 TSval=926448 TSecr=809210,08:00:27:53:41:85,08:00:27:0e:06:81,192.168.1.5,192.168.1.4,TCP,1883,59662,0x010,227,-1,-1,-1,-1,-1,-1,1
1517688387650460,68,Ping Response,08:00:27:53:41:85,08:00:27:0e:06:81,192.168.1.5,192.168.1.4,MQTT,1883,59662,0x018,227,-1,-1,0xd0,-1,-1,0,1
1517688387650575,66,59662  >  1883 [ACK] Seq=1050 Ack=3 Win=229 Len=0 TSval=809210 TSecr=926448,08:00:27:0e:06:81,08:00:27:53:41:85,192.168.1.4,192.168.1.5,TCP,59662,1883,0x010,229,-1,-1,-1,-1,-1,-1,1
1517688387745576,42,Who has 192.168.1.7? Tell 192.168.1.5,08:00:27:53:41:85,08:00:27:71:f1:05,PcsCompu_53:41:85,PcsCompu_71:f1:05,ARP,-1,-1,-1,-1,-1,-1,-1,-1,-1,-1,1
1517688387745791,60,192.168.1.7 is at 08:00:27:71:f1:05,08:00:27:71:f1:05,08:00:27:53:41:85,PcsCompu_71:f1:05,PcsCompu_53:41:85,ARP,-1,-1,-1,-1,-1,-1,-1,-1,-1,-1,1
1517688388249766,100,Publish Message,08:00:27:71:f1:05,08:00:27:53:41:85,192.168.1.7,192.168.1.5,MQTT,52588,1883,0x018,229,-1,-1,0x30,38.9349026567,fakeSensor2/sound,32,1
1517688388249792,66,1883  >  52588 [ACK] Seq=1 Ack=952 Win=227 Len=0 TSval=926598 TSecr=1139890,08:00:27:53:41:85,08:00:27:71:f1:05,192.168.1.5,192.168.1.7,TCP,1883,52588,0x010,227,-1,-1,-1,-1,-1,-1,1
1517688388415825,100,Publish Message,08:00:27:0e:06:81,08:00:27:53:41:85,192.168.1.4,192.168.1.5,MQTT,59662,1883,0x018,229,-1,-1,0x30,102.153347838,fakeSensor3/sound,32,1
1517688388453451,66,1883  >  59662 [ACK] Seq=3 Ack=1084 Win=227 Len=0 TSval=926649 TSecr=809401,08:00:27:53:41:85,08:00:27:0e:06:81,192.168.1.5,192.168.1.4,TCP,1883,59662,0x010,227,-1,-1,-1,-1,-1,-1,1
1517688389468726,100,Publish Message,08:00:27:71:f1:05,08:00:27:53:41:85,192.168.1.7,192.168.1.5,MQTT,52588,1883,0x018,229,-1,-1,0x30,114.642610974,fakeSensor2/sound,32,1
1517688389468748,66,1883  >  52588 [ACK] Seq=1 Ack=986 Win=227 Len=0 TSval=926902 TSecr=1140194,08:00:27:53:41:85,08:00:27:71:f1:05,192.168.1.5,192.168.1.7,TCP,1883,52588,0x010,227,-1,-1,-1,-1,-1,-1,1
1517688389587736,100,Publish Message,08:00:27:0e:06:81,08:00:27:53:41:85,192.168.1.4,192.168.1.5,MQTT,59662,1883,0x018,229,-1,-1,0x30,32.0312564333,fakeSensor3/sound,32,1
1517688389587767,66,1883  >  59662 [ACK] Seq=3 Ack=1118 Win=227 Len=0 TSval=926932 TSecr=809694,08:00:27:53:41:85,08:00:27:0e:06:81,192.168.1.5,192.168.1.4,TCP,1883,59662,0x010,227,-1,-1,-1,-1,-1,-1,1
1517688390661895,100,Publish Message,08:00:27:0e:06:81,08:00:27:53:41:85,192.168.1.4,192.168.1.5,MQTT,59662,1883,0x018,229,-1,-1,0x30,73.6629764042,fakeSensor3/sound,32,1
1517688390661921,66,1883  >  59662 [ACK] Seq=3 Ack=1152 Win=227 Len=0 TSval=927201 TSecr=809963,08:00:27:53:41:85,08:00:27:0e:06:81,192.168.1.5,192.168.1.4,TCP,1883,59662,0x010,227,-1,-1,-1,-1,-1,-1,1
1517688390767953,100,Publish Message,08:00:27:71:f1:05,08:00:27:53:41:85,192.168.1.7,192.168.1.5,MQTT,52588,1883,0x018,229,-1,-1,0x30,106.220028813,fakeSensor2/sound,32,1
1517688390767985,66,1883  >  52588 [ACK] Seq=1 Ack=1020 Win=227 Len=0 TSval=927227 TSecr=1140519,08:00:27:53:41:85,08:00:27:71:f1:05,192.168.1.5,192.168.1.7,TCP,1883,52588,0x010,227,-1,-1,-1,-1,-1,-1,1
1517688391336400,100,Publish Message,08:00:27:0e:06:81,08:00:27:53:41:85,192.168.1.4,192.168.1.5,MQTT,59662,1883,0x018,229,-1,-1,0x30,52.1861988061,fakeSensor3/sound,32,1
1517688391336437,66,1883  >  59662 [ACK] Seq=3 Ack=1186 Win=227 Len=0 TSval=927369 TSecr=810131,08:00:27:53:41:85,08:00:27:0e:06:81,192.168.1.5,192.168.1.4,TCP,1883,59662,0x010,227,-1,-1,-1,-1,-1,-1,1
1517688392005735,100,Publish Message,08:00:27:71:f1:05,08:00:27:53:41:85,192.168.1.7,192.168.1.5,MQTT,52588,1883,0x018,229,-1,-1,0x30,67.6391144014,fakeSensor2/sound,32,1
1517688392005760,66,1883  >  52588 [ACK] Seq=1 Ack=1054 Win=227 Len=0 TSval=927537 TSecr=1140829,08:00:27:53:41:85,08:00:27:71:f1:05,192.168.1.5,192.168.1.7,TCP,1883,52588,0x010,227,-1,-1,-1,-1,-1,-1,1
1517688392347628,100,Publish Message,08:00:27:0e:06:81,08:00:27:53:41:85,192.168.1.4,192.168.1.5,MQTT,59662,1883,0x018,229,-1,-1,0x30,41.6959896905,fakeSensor3/sound,32,1
1517688392347664,66,1883  >  59662 [ACK] Seq=3 Ack=1220 Win=227 Len=0 TSval=927622 TSecr=810384,08:00:27:53:41:85,08:00:27:0e:06:81,192.168.1.5,192.168.1.4,TCP,1883,59662,0x010,227,-1,-1,-1,-1,-1,-1,1
1517688392666453,100,Publish Message,08:00:27:71:f1:05,08:00:27:53:41:85,192.168.1.7,192.168.1.5,MQTT,52588,1883,0x018,229,-1,-1,0x30,92.1263246716,fakeSensor2/sound,32,1
1517688392666486,66,1883  >  52588 [ACK] Seq=1 Ack=1088 Win=227 Len=0 TSval=927702 TSecr=1140994,08:00:27:53:41:85,08:00:27:71:f1:05,192.168.1.5,192.168.1.7,TCP,1883,52588,0x010,227,-1,-1,-1,-1,-1,-1,1
1517688392905590,100,Publish Message,08:00:27:0e:06:81,08:00:27:53:41:85,192.168.1.4,192.168.1.5,MQTT,59662,1883,0x018,229,-1,-1,0x30,79.4804367644,fakeSensor3/sound,32,1
1517688392905627,66,1883  >  59662 [ACK] Seq=3 Ack=1254 Win=227 Len=0 TSval=927762 TSecr=810524,08:00:27:53:41:85,08:00:27:0e:06:81,192.168.1.5,192.168.1.4,TCP,1883,59662,0x010,227,-1,-1,-1,-1,-1,-1,1
1517688393780761,100,Publish Message,08:00:27:71:f1:05,08:00:27:53:41:85,192.168.1.7,192.168.1.5,MQTT,52588,1883,0x018,229,-1,-1,0x30,79.7098528337,fakeSensor2/sound,32,1
1517688393780779,66,1883  >  52588 [ACK] Seq=1 Ack=1122 Win=227 Len=0 TSval=927980 TSecr=1141272,08:00:27:53:41:85,08:00:27:71:f1:05,192.168.1.5,192.168.1.7,TCP,1883,52588,0x010,227,-1,-1,-1,-1,-1,-1,1
1517688394495222,100,Publish Message,08:00:27:0e:06:81,08:00:27:53:41:85,192.168.1.4,192.168.1.5,MQTT,59662,1883,0x018,229,-1,-1,0x30,54.1125983505,fakeSensor3/sound,32,1
1517688394495244,66,1883  >  59662 [ACK] Seq=3 Ack=1288 Win=227 Len=0 TSval=928159 TSecr=810921,08:00:27:53:41:85,08:00:27:0e:06:81,192.168.1.5,192.168.1.4,TCP,1883,59662,0x010,227,-1,-1,-1,-1,-1,-1,1
1517688395058616,100,Publish Message,08:00:27:71:f1:05,08:00:27:53:41:85,192.168.1.7,192.168.1.5,MQTT,52588,1883,0x018,229,-1,-1,0x30,118.410868485,fakeSensor2/sound,32,1
1517688395058637,66,1883  >  52588 [ACK] Seq=1 Ack=1156 Win=227 Len=0 TSval=928300 TSecr=1141592,08:00:27:53:41:85,08:00:27:71:f1:05,192.168.1.5,192.168.1.7,TCP,1883,52588,0x010,227,-1,-1,-1,-1,-1,-1,1
1517688395460512,100,Publish Message,08:00:27:0e:06:81,08:00:27:53:41:85,192.168.1.4,192.168.1.5,MQTT,59662,1883,0x018,229,-1,-1,0x30,23.6720292734,fakeSensor3/sound,32,1
1517688395460552,66,1883  >  59662 [ACK] Seq=3 Ack=1322 Win=227 Len=0 TSval=928400 TSecr=811162,08:00:27:53:41:85,08:00:27:0e:06:81,192.168.1.5,192.168.1.4,TCP,1883,59662,0x010,227,-1,-1,-1,-1,-1,-1,1
1517688396626088,100,Publish Message,08:00:27:0e:06:81,08:00:27:53:41:85,192.168.1.4,192.168.1.5,MQTT,59662,1883,0x018,229,-1,-1,0x30,104.315863385,fakeSensor3/sound,32,1
1517688396626118,66,1883  >  59662 [ACK] Seq=3 Ack=1356 Win=227 Len=0 TSval=928692 TSecr=811454,08:00:27:53:41:85,08:00:27:0e:06:81,192.168.1.5,192.168.1.4,TCP,1883,59662,0x010,227,-1,-1,-1,-1,-1,-1,1
1517688396669739,99,Publish Message,08:00:27:71:f1:05,08:00:27:53:41:85,192.168.1.7,192.168.1.5,MQTT,52588,1883,0x018,229,-1,-1,0x30,32.301774496,fakeSensor2/sound,31,1
1517688396669767,66,1883  >  52588 [ACK] Seq=1 Ack=1189 Win=227 Len=0 TSval=928703 TSecr=1141995,08:00:27:53:41:85,08:00:27:71:f1:05,192.168.1.5,192.168.1.7,TCP,1883,52588,0x010,227,-1,-1,-1,-1,-1,-1,1
1517688398094548,100,Publish Message,08:00:27:71:f1:05,08:00:27:53:41:85,192.168.1.7,192.168.1.5,MQTT,52588,1883,0x018,229,-1,-1,0x30,28.8383462042,fakeSensor2/sound,32,1
1517688398094573,66,1883  >  52588 [ACK] Seq=1 Ack=1223 Win=227 Len=0 TSval=929059 TSecr=1142351,08:00:27:53:41:85,08:00:27:71:f1:05,192.168.1.5,192.168.1.7,TCP,1883,52588,0x010,227,-1,-1,-1,-1,-1,-1,1
1517688398538895,100,Publish Message,08:00:27:0e:06:81,08:00:27:53:41:85,192.168.1.4,192.168.1.5,MQTT,59662,1883,0x018,229,-1,-1,0x30,83.4827018546,fakeSensor3/sound,32,1
1517688398538930,66,1883  >  59662 [ACK] Seq=3 Ack=1390 Win=227 Len=0 TSval=929170 TSecr=811932,08:00:27:53:41:85,08:00:27:0e:06:81,192.168.1.5,192.168.1.4,TCP,1883,59662,0x010,227,-1,-1,-1,-1,-1,-1,1
1517688399568423,100,Publish Message,08:00:27:71:f1:05,08:00:27:53:41:85,192.168.1.7,192.168.1.5,MQTT,52588,1883,0x018,229,-1,-1,0x30,118.654755887,fakeSensor2/sound,32,1
1517688399568453,66,1883  >  52588 [ACK] Seq=1 Ack=1257 Win=227 Len=0 TSval=929427 TSecr=1142719,08:00:27:53:41:85,08:00:27:71:f1:05,192.168.1.5,192.168.1.7,TCP,1883,52588,0x010,227,-1,-1,-1,-1,-1,-1,1
1517688400065091,100,Publish Message,08:00:27:0e:06:81,08:00:27:53:41:85,192.168.1.4,192.168.1.5,MQTT,59662,1883,0x018,229,-1,-1,0x30,105.155761695,fakeSensor3/sound,32,1
1517688400065134,66,1883  >  59662 [ACK] Seq=3 Ack=1424 Win=227 Len=0 TSval=929551 TSecr=812313,08:00:27:53:41:85,08:00:27:0e:06:81,192.168.1.5,192.168.1.4,TCP,1883,59662,0x010,227,-1,-1,-1,-1,-1,-1,1
1517688400854239,100,Publish Message,08:00:27:71:f1:05,08:00:27:53:41:85,192.168.1.7,192.168.1.5,MQTT,52588,1883,0x018,229,-1,-1,0x30,47.1624880547,fakeSensor2/sound,32,1
1517688400854264,66,1883  >  52588 [ACK] Seq=1 Ack=1291 Win=227 Len=0 TSval=929749 TSecr=1143041,08:00:27:53:41:85,08:00:27:71:f1:05,192.168.1.5,192.168.1.7,TCP,1883,52588,0x010,227,-1,-1,-1,-1,-1,-1,1
1517688401281924,100,Publish Message,08:00:27:0e:06:81,08:00:27:53:41:85,192.168.1.4,192.168.1.5,MQTT,59662,1883,0x018,229,-1,-1,0x30,20.8738833658,fakeSensor3/sound,32,1
1517688401281956,66,1883  >  59662 [ACK] Seq=3 Ack=1458 Win=227 Len=0 TSval=929856 TSecr=812618,08:00:27:53:41:85,08:00:27:0e:06:81,192.168.1.5,192.168.1.4,TCP,1883,59662,0x010,227,-1,-1,-1,-1,-1,-1,1
1517688401719187,100,Publish Message,08:00:27:71:f1:05,08:00:27:53:41:85,192.168.1.7,192.168.1.5,MQTT,52588,1883,0x018,229,-1,-1,0x30,38.2218039357,fakeSensor2/sound,32,1
1517688401719213,66,1883  >  52588 [ACK] Seq=1 Ack=1325 Win=227 Len=0 TSval=929965 TSecr=1143257,08:00:27:53:41:85,08:00:27:71:f1:05,192.168.1.5,192.168.1.7,TCP,1883,52588,0x010,227,-1,-1,-1,-1,-1,-1,1
1517688402716343,100,Publish Message,08:00:27:0e:06:81,08:00:27:53:41:85,192.168.1.4,192.168.1.5,MQTT,59662,1883,0x018,229,-1,-1,0x30,69.4385436401,fakeSensor3/sound,32,1
1517688402716377,66,1883  >  59662 [ACK] Seq=3 Ack=1492 Win=227 Len=0 TSval=930214 TSecr=812976,08:00:27:53:41:85,08:00:27:0e:06:81,192.168.1.5,192.168.1.4,TCP,1883,59662,0x010,227,-1,-1,-1,-1,-1,-1,1
1517688402915370,100,Publish Message,08:00:27:71:f1:05,08:00:27:53:41:85,192.168.1.7,192.168.1.5,MQTT,52588,1883,0x018,229,-1,-1,0x30,37.7940209579,fakeSensor2/sound,32,1
1517688402915390,66,1883  >  52588 [ACK] Seq=1 Ack=1359 Win=227 Len=0 TSval=930264 TSecr=1143556,08:00:27:53:41:85,08:00:27:71:f1:05,192.168.1.5,192.168.1.7,TCP,1883,52588,0x010,227,-1,-1,-1,-1,-1,-1,1
1517688403459559,100,Publish Message,08:00:27:0e:06:81,08:00:27:53:41:85,192.168.1.4,192.168.1.5,MQTT,59662,1883,0x018,229,-1,-1,0x30,28.2066561018,fakeSensor3/sound,32,1
1517688403459593,66,1883  >  59662 [ACK] Seq=3 Ack=1526 Win=227 Len=0 TSval=930400 TSecr=813162,08:00:27:53:41:85,08:00:27:0e:06:81,192.168.1.5,192.168.1.4,TCP,1883,59662,0x010,227,-1,-1,-1,-1,-1,-1,1
1517688403852584,100,Publish Message,08:00:27:71:f1:05,08:00:27:53:41:85,192.168.1.7,192.168.1.5,MQTT,52588,1883,0x018,229,-1,-1,0x30,103.241506963,fakeSensor2/sound,32,1
1517688403852602,66,1883  >  52588 [ACK] Seq=1 Ack=1393 Win=227 Len=0 TSval=930498 TSecr=1143790,08:00:27:53:41:85,08:00:27:71:f1:05,192.168.1.5,192.168.1.7,TCP,1883,52588,0x010,227,-1,-1,-1,-1,-1,-1,1
1517688404775377,100,Publish Message,08:00:27:71:f1:05,08:00:27:53:41:85,192.168.1.7,192.168.1.5,MQTT,52588,1883,0x018,229,-1,-1,0x30,103.572663386,fakeSensor2/sound,32,1
1517688404775397,66,1883  >  52588 [ACK] Seq=1 Ack=1427 Win=227 Len=0 TSval=930729 TSecr=1144021,08:00:27:53:41:85,08:00:27:71:f1:05,192.168.1.5,192.168.1.7,TCP,1883,52588,0x010,227,-1,-1,-1,-1,-1,-1,1
1517688404905555,100,Publish Message,08:00:27:0e:06:81,08:00:27:53:41:85,192.168.1.4,192.168.1.5,MQTT,59662,1883,0x018,229,-1,-1,0x30,21.5072211102,fakeSensor3/sound,32,1
1517688404905581,66,1883  >  59662 [ACK] Seq=3 Ack=1560 Win=227 Len=0 TSval=930762 TSecr=813523,08:00:27:53:41:85,08:00:27:0e:06:81,192.168.1.5,192.168.1.4,TCP,1883,59662,0x010,227,-1,-1,-1,-1,-1,-1,1
1517688405479935,100,Publish Message,08:00:27:71:f1:05,08:00:27:53:41:85,192.168.1.7,192.168.1.5,MQTT,52588,1883,0x018,229,-1,-1,0x30,35.7055809137,fakeSensor2/sound,32,1
1517688405479975,66,1883  >  52588 [ACK] Seq=1 Ack=1461 Win=227 Len=0 TSval=930905 TSecr=1144197,08:00:27:53:41:85,08:00:27:71:f1:05,192.168.1.5,192.168.1.7,TCP,1883,52588,0x010,227,-1,-1,-1,-1,-1,-1,1
1517688406009922,100,Publish Message,08:00:27:0e:06:81,08:00:27:53:41:85,192.168.1.4,192.168.1.5,MQTT,59662,1883,0x018,229,-1,-1,0x30,116.017149594,fakeSensor3/sound,32,1
1517688406009947,66,1883  >  59662 [ACK] Seq=3 Ack=1594 Win=227 Len=0 TSval=931038 TSecr=813800,08:00:27:53:41:85,08:00:27:0e:06:81,192.168.1.5,192.168.1.4,TCP,1883,59662,0x010,227,-1,-1,-1,-1,-1,-1,1
1517688406026984,100,Publish Message,08:00:27:71:f1:05,08:00:27:53:41:85,192.168.1.7,192.168.1.5,MQTT,52588,1883,0x018,229,-1,-1,0x30,57.6752713228,fakeSensor2/sound,32,1
1517688406027010,66,1883  >  52588 [ACK] Seq=1 Ack=1495 Win=227 Len=0 TSval=931042 TSecr=1144334,08:00:27:53:41:85,08:00:27:71:f1:05,192.168.1.5,192.168.1.7,TCP,1883,52588,0x010,227,-1,-1,-1,-1,-1,-1,1
1517688407719940,100,Publish Message,08:00:27:71:f1:05,08:00:27:53:41:85,192.168.1.7,192.168.1.5,MQTT,52588,1883,0x018,229,-1,-1,0x30,57.2340317895,fakeSensor2/sound,32,1
1517688407719982,66,1883  >  52588 [ACK] Seq=1 Ack=1529 Win=227 Len=0 TSval=931465 TSecr=1144757,08:00:27:53:41:85,08:00:27:71:f1:05,192.168.1.5,192.168.1.7,TCP,1883,52588,0x010,227,-1,-1,-1,-1,-1,-1,1
1517688407736827,100,Publish Message,08:00:27:0e:06:81,08:00:27:53:41:85,192.168.1.4,192.168.1.5,MQTT,59662,1883,0x018,229,-1,-1,0x30,77.0037122852,fakeSensor3/sound,32,1
1517688407736859,66,1883  >  59662 [ACK] Seq=3 Ack=1628 Win=227 Len=0 TSval=931469 TSecr=814231,08:00:27:53:41:85,08:00:27:0e:06:81,192.168.1.5,192.168.1.4,TCP,1883,59662,0x010,227,-1,-1,-1,-1,-1,-1,1
1517688408748800,100,Publish Message,08:00:27:0e:06:81,08:00:27:53:41:85,192.168.1.4,192.168.1.5,MQTT,59662,1883,0x018,229,-1,-1,0x30,107.787698661,fakeSensor3/sound,32,1
1517688408748862,66,1883  >  59662 [ACK] Seq=3 Ack=1662 Win=227 Len=0 TSval=931722 TSecr=814484,08:00:27:53:41:85,08:00:27:0e:06:81,192.168.1.5,192.168.1.4,TCP,1883,59662,0x010,227,-1,-1,-1,-1,-1,-1,1
1517688409475122,99,Publish Message,08:00:27:71:f1:05,08:00:27:53:41:85,192.168.1.7,192.168.1.5,MQTT,52588,1883,0x018,229,-1,-1,0x30,100.80221237,fakeSensor2/sound,31,1
1517688409475186,66,1883  >  52588 [ACK] Seq=1 Ack=1562 Win=227 Len=0 TSval=931904 TSecr=1145196,08:00:27:53:41:85,08:00:27:71:f1:05,192.168.1.5,192.168.1.7,TCP,1883,52588,0x010,227,-1,-1,-1,-1,-1,-1,1
1517688409507150,99,Publish Message,08:00:27:0e:06:81,08:00:27:53:41:85,192.168.1.4,192.168.1.5,MQTT,59662,1883,0x018,229,-1,-1,0x30,25.480561716,fakeSensor3/sound,31,1
1517688409507187,66,1883  >  59662 [ACK] Seq=3 Ack=1695 Win=227 Len=0 TSval=931912 TSecr=814674,08:00:27:53:41:85,08:00:27:0e:06:81,192.168.1.5,192.168.1.4,TCP,1883,59662,0x010,227,-1,-1,-1,-1,-1,-1,1
1517688410323983,100,Publish Message,08:00:27:0e:06:81,08:00:27:53:41:85,192.168.1.4,192.168.1.5,MQTT,59662,1883,0x018,229,-1,-1,0x30,109.796357768,fakeSensor3/sound,32,1
1517688410324001,66,1883  >  59662 [ACK] Seq=3 Ack=1729 Win=227 Len=0 TSval=932116 TSecr=814878,08:00:27:53:41:85,08:00:27:0e:06:81,192.168.1.5,192.168.1.4,TCP,1883,59662,0x010,227,-1,-1,-1,-1,-1,-1,1
1517688410652361,100,Publish Message,08:00:27:71:f1:05,08:00:27:53:41:85,192.168.1.7,192.168.1.5,MQTT,52588,1883,0x018,229,-1,-1,0x30,89.8777333528,fakeSensor2/sound,32,1
1517688410652394,66,1883  >  52588 [ACK] Seq=1 Ack=1596 Win=227 Len=0 TSval=932198 TSecr=1145490,08:00:27:53:41:85,08:00:27:71:f1:05,192.168.1.5,192.168.1.7,TCP,1883,52588,0x010,227,-1,-1,-1,-1,-1,-1,1
1517688410970550,100,Publish Message,08:00:27:0e:06:81,08:00:27:53:41:85,192.168.1.4,192.168.1.5,MQTT,59662,1883,0x018,229,-1,-1,0x30,119.080546281,fakeSensor3/sound,32,1
1517688410970589,66,1883  >  59662 [ACK] Seq=3 Ack=1763 Win=227 Len=0 TSval=932278 TSecr=815040,08:00:27:53:41:85,08:00:27:0e:06:81,192.168.1.5,192.168.1.4,TCP,1883,59662,0x010,227,-1,-1,-1,-1,-1,-1,1
1517688411717213,100,Publish Message,08:00:27:0e:06:81,08:00:27:53:41:85,192.168.1.4,192.168.1.5,MQTT,59662,1883,0x018,229,-1,-1,0x30,58.8963216793,fakeSensor3/sound,32,1
1517688411717234,66,1883  >  59662 [ACK] Seq=3 Ack=1797 Win=227 Len=0 TSval=932465 TSecr=815226,08:00:27:53:41:85,08:00:27:0e:06:81,192.168.1.5,192.168.1.4,TCP,1883,59662,0x010,227,-1,-1,-1,-1,-1,-1,1
1517688412088072,100,Publish Message,08:00:27:71:f1:05,08:00:27:53:41:85,192.168.1.7,192.168.1.5,MQTT,52588,1883,0x018,229,-1,-1,0x30,39.8976201836,fakeSensor2/sound,32,1
1517688412088109,66,1883  >  52588 [ACK] Seq=1 Ack=1630 Win=227 Len=0 TSval=932557 TSecr=1145849,08:00:27:53:41:85,08:00:27:71:f1:05,192.168.1.5,192.168.1.7,TCP,1883,52588,0x010,227,-1,-1,-1,-1,-1,-1,1
1517688412407984,100,Publish Message,08:00:27:0e:06:81,08:00:27:53:41:85,192.168.1.4,192.168.1.5,MQTT,59662,1883,0x018,229,-1,-1,0x30,95.5858580918,fakeSensor3/sound,32,1
1517688412408023,66,1883  >  59662 [ACK] Seq=3 Ack=1831 Win=227 Len=0 TSval=932637 TSecr=815399,08:00:27:53:41:85,08:00:27:0e:06:81,192.168.1.5,192.168.1.4,TCP,1883,59662,0x010,227,-1,-1,-1,-1,-1,-1,1
1517688413090502,68,Ping Request,08:00:27:71:f1:05,08:00:27:53:41:85,192.168.1.7,192.168.1.5,MQTT,52588,1883,0x018,229,-1,-1,0xc0,-1,-1,0,1
1517688413090523,66,1883  >  52588 [ACK] Seq=1 Ack=1632 Win=227 Len=0 TSval=932808 TSecr=1146100,08:00:27:53:41:85,08:00:27:71:f1:05,192.168.1.5,192.168.1.7,TCP,1883,52588,0x010,227,-1,-1,-1,-1,-1,-1,1
